{
  "schema_version": "1",
  "artifact_type": "plan-invariants",
  "plan_id": "FS0-CORE-PLAN",
  "invariants": [
    {
      "id": "INV-001",
      "statement": "Selected Design remains authoritative while Planning owns normative distillation and Build owns realization.",
      "requirement_ids": [
        "FS0-NR-001",
        "FS0-NR-006",
        "FS0-NR-007",
        "FS0-NR-008",
        "FS0-NR-025",
        "FS0-NR-029",
        "FS0-NR-100",
        "FS0-NR-102",
        "FS0-NR-104"
      ]
    },
    {
      "id": "INV-002",
      "statement": "Each Planning cycle selects exactly one coherent functional set and later functional sets technically depend on FS0-Core.",
      "requirement_ids": [
        "FS0-NR-013",
        "FS0-NR-015",
        "FS0-NR-018"
      ]
    },
    {
      "id": "INV-003",
      "statement": "The accepted Plan is one closed logical document graph rooted at plan.json and authorizes only explicitly planned mutation scope.",
      "requirement_ids": [
        "FS0-NR-071",
        "FS0-NR-072",
        "FS0-NR-079",
        "FS0-NR-080",
        "FS0-NR-081",
        "FS0-NR-097",
        "FS0-NR-210",
        "FS0-NR-211",
        "FS0-NR-212",
        "FS0-NR-215",
        "FS0-NR-216",
        "FS0-NR-217",
        "FS0-NR-218",
        "FS0-NR-219",
        "FS0-NR-220",
        "FS0-NR-221",
        "FS0-NR-222",
        "FS0-NR-223",
        "FS0-NR-224",
        "FS0-NR-225",
        "FS0-NR-226"
      ]
    },
    {
      "id": "INV-004",
      "statement": "Build consumes one accepted Plan, uses its predecessor, remains inside its mutation scope, and does not invent upstream authority.",
      "requirement_ids": [
        "FS0-NR-098",
        "FS0-NR-099",
        "FS0-NR-101",
        "FS0-NR-102",
        "FS0-NR-103",
        "FS0-NR-104",
        "FS0-NR-108",
        "FS0-NR-109",
        "FS0-NR-110",
        "FS0-NR-111",
        "FS0-NR-112",
        "FS0-NR-113"
      ]
    },
    {
      "id": "INV-005",
      "statement": "Governance, Conformance, and Assurance remain authority-separated and governed Core state is default-deny.",
      "requirement_ids": [
        "FS0-NR-127",
        "FS0-NR-128",
        "FS0-NR-129",
        "FS0-NR-130",
        "FS0-NR-131",
        "FS0-NR-136",
        "FS0-NR-137",
        "FS0-NR-139",
        "FS0-NR-194",
        "FS0-NR-195"
      ]
    },
    {
      "id": "INV-006",
      "statement": "Acceptance is explicit, non-circular, bounded, and preserves the minimum resolvable Design-to-Build lineage.",
      "requirement_ids": [
        "FS0-NR-093",
        "FS0-NR-094",
        "FS0-NR-095",
        "FS0-NR-096",
        "FS0-NR-140",
        "FS0-NR-141",
        "FS0-NR-142",
        "FS0-NR-143",
        "FS0-NR-144",
        "FS0-NR-145",
        "FS0-NR-146",
        "FS0-NR-147",
        "FS0-NR-151",
        "FS0-NR-152",
        "FS0-NR-153",
        "FS0-NR-154",
        "FS0-NR-155",
        "FS0-NR-156",
        "FS0-NR-158",
        "FS0-NR-160"
      ]
    },
    {
      "id": "INV-007",
      "statement": "Each Core normative requirement has stable identity and explicit Conformance and Assurance applicability.",
      "requirement_ids": [
        "FS0-NR-025",
        "FS0-NR-036",
        "FS0-NR-038",
        "FS0-NR-161",
        "FS0-NR-162",
        "FS0-NR-163",
        "FS0-NR-164"
      ]
    },
    {
      "id": "INV-009",
      "statement": "The built Core demonstrates enough maintained Conformance and Assurance capability to govern one successor functional-set cycle.",
      "requirement_ids": [
        "FS0-NR-254",
        "FS0-NR-255"
      ]
    },
    {
      "id": "INV-010",
      "statement": "Committed Design and Planning artifacts between the declared implementation predecessor and Build start do not become implementation realization; any non-artifact mutation invalidates that bridge.",
      "requirement_ids": [
        "FS0-NR-256",
        "FS0-NR-257",
        "FS0-NR-258",
        "FS0-NR-259"
      ]
    }
  ]
}
